{
  "schema_version": "promotion-state-v0",
  "artifact_id": "artifact-ai-security-work-v0",
  "loop": [
    "AI-assisted security work",
    "Artifact Intake",
    "Evidence Graph",
    "Telemetry Contract Check",
    "Controlled Validation",
    "Runtime Candidate Ledger",
    "Signal Observation",
    "Human Review Gate",
    "ProofCard",
    "Claim Authority",
    "Safe Claim / Blocked Claim"
  ],
  "current_stage": "Claim Authority",
  "gates": {
    "artifact_intake": "accepted",
    "telemetry_contract_check": "not_checked",
    "controlled_validation": "not_started"
  },
  "runtime": {
    "candidate_id": "runtime-candidate-example-v0",
    "observed": false,
    "evidence_refs": []
  },
  "signal": {
    "observed": false,
    "evidence_refs": []
  },
  "human_review_gate": {
    "status": "pending",
    "review_refs": []
  },
  "proofcard": {
    "status": "draft",
    "proofcard_id": "proofcard-example-v0",
    "evidence_refs": []
  },
  "claim_authority": {
    "capability": "Claim Firewall",
    "disposition": "blocked_claim",
    "public_safe": false,
    "blocked_reasons": [
      "Telemetry contract check is not checked.",
      "Controlled validation has not started.",
      "Runtime candidate is not observed.",
      "Signal observation is not observed.",
      "Human Review Gate is pending."
    ]
  }
}
